INDEX,QCODE,SOURCE,LAYER1,LAYER2,LAYER3,TYPE,CODE1,CODE2,TITLE,QUESTION,INPUT,RESULT,ANSWER,풀이회수,정답회수,오답회수,오답율,EXPLAIN,ANALSYS,1ST,2ND,3rd,4th,5th,6th,7th,8th,9th,10th
522,ABANK-0522,인스교재,08배상책임보험,전문직업배상,의료과실,진위형,AC06,AC06,정의,"의료분쟁조정법에서 의료사고란 건의료인(「의료법」제27조 제1항 단서 또는 『약사법」제23조 제1항 단서에 따라 그 행위가 허용되는 자를 포함한다)이 환자에 대하여 실시하는 진단 • 검사 • 치료 • 의약품의 처방 및 조제 등의 행위(이하 ""의료행위등""이라 한다)로 인하여 사람의 생명 신체 및 재산에 대하여 피해가 발생한 경우를 말한다.",O,O,O,10.0,10.0,0,,,,,,,,,,,,,
523,ABANK-0523,인스교재,08배상책임보험,전문직업배상,의료과실,진위형,AC06,AC06,정의,"의료분쟁조정법에서 의료분쟁이란 건의료인(「의료법」제27조 제1항 단서 또는 『약사법」제23조 제1항 단서에 따라 그 행위가 허용되는 자를 포함한다)이 환자에 대하여 실시하는 진단 • 검사 • 치료 • 의약품의 처방 및 조제 등의 행위(이하 ""의료행위등""이라 한다)로 인하여 사람의 생명 신체 및 재산에 대하여 피해가 발생한 경우를 말한다.",,X,X,10.0,10.0,0,,의료사고,,,,,,,,,,,
524,ABANK-0524,인스교재,08배상책임보험,전문직업배상,의료과실,진위형,AC06,AC06,정의,"의료분쟁조정법에서 의료과실이란 건의료인(「의료법」제27조 제1항 단서 또는 『약사법」제23조 제1항 단서에 따라 그 행위가 허용되는 자를 포함한다)이 환자에 대하여 실시하는 진단 • 검사 • 치료 • 의약품의 처방 및 조제 등의 행위(이하 ""의료행위등""이라 한다)로 인하여 사람의 생명 신체 및 재산에 대하여 피해가 발생한 경우를 말한다.",,X,X,10.0,10.0,0,,의료사고,,,,,,,,,,,
525,ABANK-0525,인스교재,08배상책임보험,전문직업배상,의료과실,진위형,AC06,AC06,정의,"의료분쟁조정법에서 의료쟁의란 건의료인(「의료법」제27조 제1항 단서 또는 『약사법」제23조 제1항 단서에 따라 그 행위가 허용되는 자를 포함한다)이 환자에 대하여 실시하는 진단 • 검사 • 치료 • 의약품의 처방 및 조제 등의 행위(이하 ""의료행위등""이라 한다)로 인하여 사람의 생명 신체 및 재산에 대하여 피해가 발생한 경우를 말한다.",,X,X,10.0,10.0,0,,의료사고,,,,,,,,,,,
526,ABANK-0526,인스교재,08배상책임보험,전문직업배상,의료과실,진위형,AC06,AC06,분쟁조정법률,조정이 성립하면 이는 재판상 화해와 동일한 효력이 있다,O,O,O,10.0,10.0,0,,,,,,,,,,,,,
527,ABANK-0527,인스교재,08배상책임보험,전문직업배상,의료과실,진위형,AC06,AC06,분쟁조정법률,의료분쟁조정법의 조정의 효과는 재판상의 중재와 동일한 효력이 있다.,,X,X,10.0,10.0,0,,화해,,,,,,,,,,,
528,ABANK-0528,인스교재,08배상책임보험,전문직업배상,의료과실,진위형,AC06,AC06,분쟁조정법률,조정이 성립하면 이는 재판상 확정판결과 동일한 효력이 있다,,X,X,10.0,10.0,0,,화해,,,,,,,,,,,
529,ABANK-0529,인스교재,08배상책임보험,전문직업배상,의료과실,진위형,AC06,AC06,분쟁조정법률,조정이 성립하면 민법상 화해와 동일한 효력이 있다,,X,X,10.0,10.0,0,,재판상 화해,,,,,,,,,,,
530,ABANK-0530,인스교재,08배상책임보험,전문직업배상,의료과실,진위형,AC06,AC06,분쟁조정법률,합의에 따라 작성된 조정조서는 재판상 화해와 동일한 효력이 있다,O,O,O,10.0,10.0,0,,,,,,,,,,,,,
531,ABANK-0531,인스교재,08배상책임보험,전문직업배상,의료과실,진위형,AC06,AC06,분쟁조정법률,합의에 따라 작성된 조정조서는 중재와 동일한 효력이 있다,,X,X,10.0,10.0,0,,,,,,,,,,,,,
532,ABANK-0532,인스교재,08배상책임보험,전문직업배상,의료과실,진위형,AC06,AC06,분쟁조정법률,합의에 따라 작성된 조정조서는 확정판결과 동일한 효력이 있다,,X,X,10.0,10.0,0,,,,,,,,,,,,,
533,ABANK-0533,인스교재,08배상책임보험,전문직업배상,의료과실,진위형,AC06,AC06,분쟁조정법률,중재판정은 확정판결과 동일한 효력이 있다,O,O,O,10.0,10.0,0,,,,,,,,,,,,,
534,ABANK-0534,인스교재,08배상책임보험,전문직업배상,의료과실,진위형,AC06,AC06,분쟁조정법률,"의료분쟁조정법에 따라 조정이 성립하거나 합의로 조정조서가 작성된 경우 및 화해중재판 정서가 작성된 경우에는 생명의 위험, 장애 또는 불치나 난치와 같은 중상해 이외에는 피해 자의 명시한 의사에 반하여 공소를 제기할 수 없다.",O,O,O,10.0,10.0,0,,,,,,,,,,,,,
535,ABANK-0535,인스교재,08배상책임보험,전문직업배상,의료과실,진위형,AC06,AC06,분쟁조정법률,"의료분쟁조정법에 따라 조정이 성립하거나 합의로 조정조서가 작성된 경우 및 화해중재판 정서가 작성된 경우에는 생명의 위험, 장애 또는 불치나 난치와 같은 중상해 이외에는 피해 자의 명시한 의사에 반하여 공소를 제기할 수 있다.",,X,X,10.0,10.0,0,,없다,,,,,,,,,,,
536,ABANK-0536,인스교재,08배상책임보험,전문직업배상,의료과실,선택형,AC06,AC06,분쟁조정법률,"의료분쟁조정법에서 조정 및 중재에 관한 다음 설명중 틀린 것은?
① 조정이 성립하면 이는 재판상 화해와 동일한 효력이 있다.
② 합의에 따라 작성된 조정조서는 재판상 화해와 동일한 효력이 있다.
③ 중재판정은 재판상 화해와 동일한 효력이 있다.
④ 분쟁의 조정신청은 의료사고의 원인이 된 행위가 종료된 날부터 10년, 피해자나 그 법정대 리인이 그 손해 및 가해자를 안 날부터 3년 내에 제기하여야 한다.",3,O,3,10.0,10.0,0,,3)확정판결,,,,,,,,,,,
537,ABANK-0537,인스교재,08배상책임보험,전문직업배상,의료과실,진위형,AC06,AC06,보상하는 손해,의료과실이 발생하면 의사나 병원은 채무불이행책임과 불법행위책임을 동시에 부담한다.,O,O,O,10.0,10.0,0,,,,,,,,,,,,,
538,ABANK-0538,인스교재,08배상책임보험,전문직업배상,의료과실,진위형,AC06,AC06,보상한도액,"의료배상책임보험의 보험요율이 상대적으로 높은 진료과목은 내과, 이비인후과, 피부과, 방사선과, 정신과, 한 방진료과 등이다.",,X,X,10.0,10.0,0,,낮은요율,,,,,,,,,,,
539,ABANK-0539,인스교재,08배상책임보험,전문직업배상,의료과실,진위형,AC06,AC06,보상한도액,"의료배상책임보험의 보험요율이 상대적으로낮은 은 진료과목은 내과, 이비인후과, 피부과, 방사선과, 정신과, 한 방진료과 등이다.",O,O,O,10.0,10.0,0,,,,,,,,,,,,,
540,ABANK-0540,인스교재,08배상책임보험,전문직업배상,의료과실,진위형,AC06,AC06,보상한도액,"의료배상책임보험의 보험요율이 상대적으로낮은 은 진료과목은 산부인과, 정형외과, 신경외과, 성형외과 등이다.",,X,X,10.0,10.0,0,,높은요율,,,,,,,,,,,
541,ABANK-0541,인스교재,08배상책임보험,전문직업배상,의료과실,진위형,AC06,AC06,보상한도액,"의료배상책임보험의 보험요율이 상대적으로 높은 은 진료과목은 산부인과, 정형외과, 신경외과, 성형외과 등이다.",O,O,O,10.0,10.0,0,,,,,,,,,,,,,
542,ABANK-0542,인스교재,08배상책임보험,전문직업배상,의료과실,진위형,AC06,AC06,분쟁조정법률,의료분쟁조정법의 중재판정은 재판상의 화해와 동일한 효력이 있다.,,X,X,10.0,9.0,1,,확정판효과,,,,,,,,,,,
543,ABANK-0543,인스교재,08배상책임보험,전문직업배상,담보위험,진위형,AC06,AC06,일반배상책임과차이,하자(Eror&Omission)배상책임보험은 전문직업인 배상책임보험에 해당한다.,O,O,O,10.0,9.0,1,,,,,,,,,,,,,
544,ABANK-0544,인스교재,08배상책임보험,전문직업배상,담보위험,진위형,AC06,AC06,개념,전문직업배상에서 피해자가 손해배상을 받기 위해서는 가해자에게 고의 또는 과실이 있음을 피해자 스스로가입증하여야 한다.,,X,X,10.0,9.0,1,,전문인이입증,,,,,,,,,,,
545,ABANK-0545,인스교재,08배상책임보험,전문직업배상,담보위험,선택형,AC06,AC06,개념,"전문인의 법률적 손해배상책임이 성립하기 위한 요건이 아닌 것은?
① 전문인의 자격 존재
② 전문인의 업무 수행 중 주의의무 위반(과실 존재)
③ 제3자에게 손해 발생
④ 과실과 손해 사이에 인과관계 존재",1,O,1,10.0,9.0,1,,1)제외,,,,,,,,,,,
546,ABANK-0546,인스교재,08배상책임보험,전문직업배상,건축사설계사배상,진위형,AC06,AC06,공제금액,의료과실 배상책임보험에서는 사고조사비용을 포함한 모든 부대비용에 대해서 공제금액 초과시만 보험금을 지급한다,,X,X,10.0,9.0,1,,건축사설계사배상보험,,,,,,,,,,,
547,ABANK-0547,인스교재,08배상책임보험,전문직업배상,건축사설계사배상,진위형,AC06,AC06,추가특별약관,건축사 및 기술사 배상책임보험을 프로젝트별 단일계약 방식으로 가입하면 발주자의 요구조건에 맞추어 보험조건을 설정할 수 있다는 장점이 있다,O,O,O,10.0,9.0,1,,,"부실, 착각",,,,,,,,,,
548,ABANK-0548,인스교재,08배상책임보험,전문직업배상,건축사설계사배상,진위형,AC06,AC06,공제금액,건축사 및 기술사 배상책임보험에서는 사고조사비용을 포함한 모든 부대비용에 대해서 공제금액을 적용하지않는다.,X,O,X,10.0,8.0,2,,공제금초과시만지급,공부 지식 부실,,,,,,,,,,
549,ABANK-0549,인스교재,08배상책임보험,전문직업배상,건축사설계사배상,진위형,AC06,AC06,공제금액,건축사 및 기술사 배상책임보험에서는 사고조사비용을 포함한 모든 부대비용에 대해서 공제금액 초과시만 보험금을 지급한다,O,O,O,10.0,7.0,3,,대부분 공제조합가입하므로 공제금액 초과시 지급,부실공부,,,,,,,,,,
550,ABANK-0550,인스교재,08배상책임보험,전문직업배상,건축사설계사배상,진위형,AC06,AC06,추가특별약관,건축사 및 기술사 배상책임보험을 연간계약 방식으로 가입하면 발주자의 요구조건에 맞추어 보험조건을 설정할 수 있다는 장점이 있다,,X,X,10.0,9.0,1,,단일계약방식,착각 집중력,,,,,,,,,,
551,ABANK-0551,인스교재,08배상책임보험,임원배상,담보위험,진위형,AC07,AC07,개요,"임원이란 상법상의 이사 및 감사 , 이에 준하는 자로 보험증권의 피보험자란에 기재된 자를 말한다",O,O,O,10.0,10.0,0,,,,,,,,,,,,,
552,ABANK-0552,인스교재,08배상책임보험,임원배상,담보위험,진위형,AC07,AC07,개요,"임원이란 민법상의 이사 및 감사 , 이에 준하는 자로 보험증권의 피보험자란에 기재된 자를 말한다",,X,X,10.0,10.0,0,,상법상,,,,,,,,,,,
553,ABANK-0553,인스교재,08배상책임보험,임원배상,담보위험,진위형,AC07,AC07,당보하는 손해,임원배상책임보험 Coverage C는 회사(법인)에게 직접 제기되는 소송에 대비하는 담보이다.,O,O,O,10.0,10.0,0,,,,,,,,,,,,,
554,ABANK-0554,인스교재,08배상책임보험,임원배상,담보위험,진위형,AC07,AC07,당보하는 손해,"임원배상책임보험에는 Coverage A, B, C가 있으며 Coverage C는 회사(법인)에게 직접 제기되는 소송에 대비하는 담보이다.",O,O,O,10.0,10.0,0,,,,,,,,,,,,,
555,ABANK-0555,인스교재,08배상책임보험,임원배상,담보위험,진위형,AC07,AC07,당보하는 손해,임원배상책임보험에서 법률상 손해배상금과 제반비용은 각각 별도의 보상한도액으로 보상한다.,,X,X,10.0,10.0,0,,모두포함,,,,,,,,,,,
556,ABANK-0556,인스교재,08배상책임보험,임원배상,담보위험,진위형,AC07,AC07,당보하는 손해,임원배상책임보험에서 법률상 손해배상금과 제반비용을 모두 포함한비용을 보상한도액 범위 내에서 보상한다.,O,O,O,10.0,10.0,0,,,,,,,,,,,,,
557,ABANK-0557,인스교재,08배상책임보험,임원배상,담보위험,진위형,AC07,AC07,당보하는 손해,임원배상책임보험은 예전에는 Coverage A와 B가 각각 나뉘었으나 현재는 하나로 통합하여 Coverage A&B로 사용되고 있다,O,O,O,10.0,10.0,0,,,,,,,,,,,,,
558,ABANK-0558,인스교재,08배상책임보험,임원배상,담보위험,진위형,AC07,AC07,당보하는 손해,임원배상책임보험은 임원이 승소하였을 경우 회사가 부담하는 소송비용을 담보하는 Company Reimburgement (회사보상조항)와 임원이 패소하였을 경우 임원 개인의 손해배상금과 방어비용을 담보하는 Directors & Ofticer's Liability(임원배상책임조항)으로 구분된다.,O,O,O,10.0,10.0,0,,,,,,,,,,,,,
559,ABANK-0559,인스교재,08배상책임보험,임원배상,담보위험,진위형,AC07,AC07,당보하는 손해,임원배상책임보험은 Entity Coverage(법인담보특약)는 다른 영업배상책임보험과는 달리 임원 개인과 법인회사 의 배상책임의 동시에 담보하는 특성이 있다,O,O,O,10.0,10.0,0,,,,,,,,,,,,,
560,ABANK-0560,인스교재,08배상책임보험,임원배상,담보위험,진위형,AC07,AC07,당보하는 손해,임원배상책임보험은 다른 전문직업배상책임보험과 달리 사고발생기준(Occurrence basie) 약관을 사용하고 있다.,,X,X,10.0,10.0,0,,손해배상청구기준,,,,,,,,,,,
561,ABANK-0561,인스교재,08배상책임보험,임원배상,담보위험,진위형,AC07,AC07,당보하는 손해,임원배상책임보험은 다른 전문직업배상책임보험과 동일하게 배상청구기준(Claim-made basis) 약관을 사용하고 있다.,O,O,O,10.0,10.0,0,,,,,,,,,,,,,
562,ABANK-0562,인스교재,08배상책임보험,임원배상,담보위험,진위형,AC07,AC07,피보험자,임원배상책임보험에서 말하는 임원에는 퇴임한 임원과 보험기간 중에 새로 선임된 입원은 포함되지 않는다.,,X,X,10.0,10.0,0,,포함가능,,,,,,,,,,,
563,ABANK-0563,인스교재,08배상책임보험,임원배상,담보위험,진위형,AC07,AC07,피보험자,임원배상책임보험에서 말하는 임원에는 퇴임한 임원과 보험기간 중에 새로 선임된 입원도 포함될 수 있다. 다만 최초계약일 이전에 이미 퇴임한 임원은 포함되지 않는다,O,O,O,10.0,10.0,0,,,,,,,,,,,,,
564,ABANK-0564,인스교재,08배상책임보험,임원배상,담보위험,진위형,AC07,AC07,보고연장기간(ERP),"자동연장담보 - Midi Tail의 조건은
① 소급담보일자~보험기간 만료일 사이에 사고 발생하고
② 보험기간 만료일부터 30일 이내 손해배상청구 제기",,X,X,10.0,10.0,0,,mini 60dlf,,,,,,,,,,,
565,ABANK-0565,인스교재,08배상책임보험,임원배상,담보위험,진위형,AC07,AC07,보고연장기간(ERP),"자동연장담보 - Midi Tail의 조건은
① 소급담보일자~보험기간 만료일 사이에 사고 발생
② 보험기간 만료일부터 60일 이내 보험회사에 통지
③ 손해배상청구가 보험기간 만료일부터 5년 이내에 이루어진 경우
④ 자동연장담보는 해지할 수 없다.",O,O,O,10.0,10.0,0,,,,,,,,,,,,,
566,ABANK-0566,인스교재,08배상책임보험,임원배상,담보위험,진위형,AC07,AC07,보고연장기간(ERP),"자동연장담보 - Midi Tail의 조건은
① 소급담보일자~보험기간 만료일 60일 이내의 사이에 사고 발생 하여야 한다.",,X,X,10.0,10.0,0,,소급일지-만료일사이 사고발생,,,,,,,,,,,
567,ABANK-0567,인스교재,08배상책임보험,임원배상,담보위험,진위형,AC07,AC07,보고연장기간(ERP),"선택연장담보의 조건은 다음과 같다
① 보험기간 만료일부터 60일 이내 보험회사에 서면으로 보고기간 연장 요청
② 기존보험료의 200% 범위 내에서 추가보험료 납입. 추가보험료를 납입하지 않으면 효력 없음
③ 추가보험료를 납입하였다면 선택연장담보는 해지할 수 없다.",O,O,O,10.0,10.0,0,,,,,,,,,,,,,
568,ABANK-0568,인스교재,08배상책임보험,임원배상,담보위험,진위형,AC07,AC07,보상하는 손해,"가장 빈번한 소송은 기업합병, 재무제표 작성, 주식 공개관련 공시의무 위반 등 회사의 경영활동에 불만을 가진주주들의 배상청구이다.",O,O,O,10.0,10.0,0,,,,,,,,,,,,,
569,ABANK-0569,인스교재,08배상책임보험,임원배상,담보위험,진위형,AC07,AC07,보상하는 손해,"가장 빈번한 소송은 불공정인사(해고, 차별대우등)와 관련하여 전현직 직원들이 제기하는 소송이다",,X,X,10.0,10.0,0,,두번째,,,,,,,,,,,
570,ABANK-0570,인스교재,08배상책임보험,임원배상,담보위험,진위형,AC07,AC07,보상하는 손해,"국내에서는 국문약관과 영문약관(AIG, Chubb, ACE 약관)을 주로 사용하며, 국문약관은 회사보상책임 담보조항(Company Reimbursement)을 특별약관으로 보상하는데 반하여, 영문약관은 회사보상책임담 보조항(Company Reimbursement)을 본문약관의 Coverage A&B에서 담보하는 차이점이 있다.",O,O,O,10.0,10.0,0,,,,,,,,,,,,,
571,ABANK-0571,인스교재,08배상책임보험,임원배상,담보위험,진위형,AC07,AC07,보상하는 손해,"국내에서는 국문약관과 영문약관(AIG, Chubb, ACE 약관)을 주로 사용하며, 영문약관은 회사보상책임 담보조항(Company Reimbursement)을 특별약관으로 보상하는데 반하여, 국문약관은 회사보상책임담 보조항(Company Reimbursement)을 본문약관의 Coverage A&B에서 담보하는 차이점이 있다.",,X,X,10.0,10.0,0,,영문국문바뀜,,,,,,,,,,,
572,ABANK-0572,인스교재,08배상책임보험,임원배상,담보약관,진위형,AC07,AC07,보상하지 않는 손해,피보험자가 불법적으로 사적인 이익을 취득함에 기인하는 배상청구는 보험금을 지급하지 않는다.,O,O,O,10.0,10.0,0,,,,,,,,,,,,,
573,ABANK-0573,인스교재,08배상책임보험,임원배상,담보약관,진위형,AC07,AC07,주요특별약관,주주대표소송은 대주주가 이사나 감사 등의 책임을 추구하기 위하여 회사를 대신하여 제기하는 소송이다.,,X,X,10.0,10.0,0,,소액주주가,,,,,,,,,,,
574,ABANK-0574,인스교재,08배상책임보험,임원배상,담보약관,진위형,AC07,AC07,주요특별약관,주주대표소송은 소주주가 이사나 감사 등의 책임을 추구하기 위하여 회사를 대신하여 제기하는 소송이다.,O,O,O,10.0,10.0,0,,,,,,,,,,,,,
575,ABANK-0575,인스교재,08배상책임보험,임원배상,담보약관,선택형,AC07,AC07,주요특별약관,"임원배상책임보험 담보약관에 대한 다음 설명 중 틀린 것은?
① 피보험자가 피해자에게 지급할 책임을 지는 법률상의 손해배상금을 담보한다.
② 국내에서는 국문약관과 영문약관(AIG, Chubb, ACE 약관)을 주로 사용하며, 국문약관은 회사보상책임담보조항(Company Reimbursement)을 특별약관으로 보상하는데 반하여, 영문약관은 회사보상책임담보조항(Company Reimbursement)을 본문약관의 Coverage A&B에서 담보하는 차이점이 있다.
③ 보험회사는 법률상 손해배상금 및 제반비용을 모두 포함한 비용을 보상한도액 범위 내에서 보상하며 5회 배상청구에 대해서 자기부담금을 초과한 경우에 한하여 그 초과분에 보험증권 에 기재된 보상비율을 곱하여 보험금으로 지급한다.
④ 피보험자에게 보수 또는 상여 등이 법령을 위반하여 지급함에 기인하는 배상청구은 보상하 지 않는다.",3,O,3,10.0,10.0,0,,1회,,,,,,,,,,,
576,ABANK-0576,인스교재,08배상책임보험,임원배상,담보위험,진위형,AC07,AC07,보고연장기간(ERP),"자동연장담보 - Mini Tail의 조건은 다음과 같다
① 소급담보일자~보험기간 만료일 사이에 사고 발생
② 보험기간 만료일부터 60일 이내 손해배상청구 제기",O,O,O,10.0,9.0,1,,연장담보60(육시럴),,,,,,,,,,,
577,ABANK-0577,인스교재,08배상책임보험,임원배상,담보위험,진위형,AC07,AC07,보고연장기간(ERP),"임원배상보험 ERP에서 자동연장담보 - Midi Tail의 조건은1손해배상청구가 보험기간 만료일부터 5년 이내에 이루어진 경우
① 자동연장담보는 해지할 수 없다",O,O,O,10.0,9.0,1,,,,,,,,,,,,,
578,ABANK-0578,인스교재,08배상책임보험,임원배상,담보위험,진위형,AC07,AC07,보고연장기간(ERP),"선택연장담보 조건은
① 소급담보일자~보험기간 만료일 사이에 사고 발생하고
② 보험기간 만료일부터 30일 이내 손해배상청구 제기",,X,X,10.0,9.0,1,,60일,,,,,,,,,,,
579,ABANK-0579,인스교재,08배상책임보험,임원배상,담보위험,진위형,AC07,AC07,보고연장기간(ERP),"자동연장담보 - Mini Tail의 조건은
① 소급담보일자~보험기간 만료일 사이에 사고 발생하고
② 보험기간 만료일부터 30일 이내 손해배상청구 제기",X,O,X,10.0,8.0,2,,연장담보60(육시럴),,,,,,,,,,,
580,ABANK-0580,인스교재,08배상책임보험,임원배상,담보위험,진위형,AC07,AC07,보상하는 손해,"임원배상책임 보험 담보약관에서 국내에서는 국문약관과 영문약관(AIG, Chubb, ACE 약관)을 주로 사용하며, 영문약관은 회사보상책임 담보조항(Company Reimbursement)을 특별약관으로 보상한다,",X,O,X,10.0,8.0,2,,국문 특별 영문A&B,,,,,,,,,,,
581,ABANK-0581,인스교재,08배상책임보험,임원배상,담보약관,진위형,AC07,AC07,보상하는 손해,"임원배상에서 국내에서는 국문약관과 영문약관(AIG, Chubb, ACE 약관)을 주로 사용하며, 국문약관은 회사보상책임담 보조항(Company Reimbursement)을 본문약관의 Coverage A&B에서 담보한다",X,O,X,10.0,8.0,2,, 영문본문A&B,"망각, 부실",,,,,,,,,,
582,ABANK-0582,인스교재,08배상책임보험,임원배상,담보약관,진위형,AC07,AC07,주요특별약관,주주대표소송은 시민단체 등 외부기관이 이사나 감사 등의 책임을 추구하기 위하여 회사를 대신하여 제기하는 소송이다.,X,O,X,10.0,8.0,2,,소액주주가,,,,,,,,,,,
583,ABANK-0583,인스교재,08배상책임보험,기타주요보험,생산물회수비용,진위형,AC08,AC08,개요,사업자는 제품에 중대한 결함이 있다는 사실을 알게 된 경우에는 제조 수입 • 판매 또는 제공한 물품등의 결할 을 소관 중앙행정기관의 장에게 보고(전자적 보고를 포함)하여야 한다.,O,O,O,10.0,10.0,0,,,,,,,,,,,,,
584,ABANK-0584,인스교재,08배상책임보험,기타주요보험,생산물회수비용,진위형,AC08,AC08,개요,중앙행정기관의 장으로부터 결합 제품의 수거 파기 등의 권고를 받았으나 정당한 사유없이 권고에 따르지 않은 사업자에 대해서는 이를 공표할 수 있다.,O,O,O,10.0,10.0,0,,,,,,,,,,,,,
585,ABANK-0585,인스교재,08배상책임보험,기타주요보험,생산물회수비용,진위형,AC08,AC08,상실이익,"리콜보험은 회수된 목적물이 정상적으로 판매되었으면 얻을 수 있었던 이익을 보상한다. 다만, 보상되는 부분 은 보험회사에게 통지된 날로부터 90일 이내의 이익으로만 제한한다.",O,O,O,10.0,10.0,0,,,,,,,,,,,,,
586,ABANK-0586,인스교재,08배상책임보험,기타주요보험,생산물회수비용,진위형,AC08,AC08,상실이익,"리콜보험은 회수된 목적물이 정상적으로 판매되었으면 얻을 수 있었던 이익을 보상한다. 다만, 보상되는 부분 은 보험회사에게 통지된 날로부터 120일 이내의 이익으로만 제한한다.",,X,X,10.0,10.0,0,,90일,,,,,,,,,,,
587,ABANK-0587,인스교재,08배상책임보험,기타주요보험,생산물회수비용,진위형,AC08,AC08,1st Party Recall,① st Party Recall은 완제품을 판매하는 기업에서 먼저 소비자에게 리콜하고 해당 손해를 부분품을 제조하는 기업에게 손해배상청구한 경우 그로 인한 손해를 보상해주는 것이다.,,X,X,10.0,10.0,0,,3rd Party Recall,,,,,,,,,,,
588,ABANK-0588,인스교재,08배상책임보험,기타주요보험,생산물회수비용,진위형,AC08,AC08,1st Party Recall,① st Party Recall은 소비자에게 판매한 결함제품을 직접 회수하고 그로 인한 비용을 보상해 주는 것이다,O,O,O,10.0,10.0,0,,,,,,,,,,,,,
589,ABANK-0589,인스교재,08배상책임보험,기타주요보험,생산물회수비용,진위형,AC08,AC08,3rd Party Recall,① rd Party Recall은 완제품을 판매하는 기업에서 먼저 소비자에게 리콜하고 해당 손해를 부분품을 제조하는 기업에게 손해배상청구한 경우 그로 인한 손해를 보상해주는 것이다.,O,O,O,10.0,10.0,0,,,,,,,,,,,,,
590,ABANK-0590,인스교재,08배상책임보험,기타주요보험,생산물회수비용,진위형,AC08,AC08,3rd Party Recall,① rd Party Recall은 소비자에게 판매한 결함제품을 직접 회수하고 그로 인한 비용을 보상해 주는 것이다,,X,X,10.0,10.0,0,,1st Party Recall,,,,,,,,,,,
